{
  "$schema": "../../case.schema.json",
  "category": "examples",
  "slug": "scatter-plot",
  "title": "R-tree scatter explorer",
  "status": "live",
  "vooyaComponent": "./src/ScatterPlot.rs",
  "host": "./DemoPage.vue",
  "interactions": ["query nearest point", "compare R-tree and linear scan", "change point count", "zoom"],
  "reference": "https://github.com/vooyajs/vooya/blob/main/docs/guide/scatter-plot.md",
  "evidence": ["Rust-file component compiled by the lab Vooya entry", "rstar crate builds an R-tree over the selected point count", "pointer queries update from both implementations"]
}
